{
  "$schema": "../../docs/theme-schema.json",
  "theme": "nd-slate-jade",
  "author": "cc-pulseline (design-lab: cool graphite + a single jade signal)",
  "description": "Cool graphite + a single jade signal \u2014 ledger/cockpit register.",
  "colors": {
    "emphasis": {
      "primary": 254,
      "secondary": 248,
      "structural": 243,
      "separator": 236
    },
    "alerts": {
      "critical": 168,
      "warning": 179,
      "git_dirty": 179,
      "high_burn": 175
    },
    "active": {
      "accent": 79,
      "success": 74,
      "git_clean": 108
    }
  },
  "palette_mapping": {
    "emphasis_primary": 254,
    "emphasis_secondary": 248,
    "emphasis_structural": 243,
    "emphasis_separator": 236,
    "alert_red": 168,
    "alert_orange": 179,
    "alert_magenta": 175,
    "active_cyan": 79,
    "active_purple": 79,
    "active_teal": 79,
    "active_amber": 179,
    "active_coral": 173,
    "stable_blue": 74,
    "stable_green": 108,
    "indicator_claude_md": 74,
    "indicator_rules": 108,
    "indicator_memory": 248,
    "indicator_hooks": 179,
    "indicator_mcp": 73,
    "indicator_skills": 79,
    "indicator_duration": 249,
    "completed_check": 74,
    "cost_base": 186,
    "cost_low_rate": 79,
    "cost_med_rate": 179,
    "cost_high_rate": 173,
    "strata_state": 236,
    "strata_activity": 59,
    "aurora_low": 73,
    "aurora_mid": 79,
    "aurora_high": 173,
    "tag_label": 243,
    "head_agent": 79,
    "head_thinking": 179
  },
  "light_emphasis": {
    "primary": 234,
    "secondary": 240,
    "structural": 245,
    "separator": 251,
    "strata_state": 252,
    "strata_activity": 246,
    "alert_red": 168,
    "alert_orange": 179,
    "alert_magenta": 175,
    "active_cyan": 73,
    "active_purple": 73,
    "active_teal": 73,
    "active_amber": 179,
    "active_coral": 173,
    "stable_blue": 74,
    "stable_green": 108,
    "indicator_claude_md": 74,
    "indicator_rules": 108,
    "indicator_memory": 109,
    "indicator_hooks": 179,
    "indicator_mcp": 73,
    "indicator_skills": 73,
    "indicator_duration": 109,
    "completed_check": 74,
    "cost_base": 143,
    "cost_low_rate": 73,
    "cost_med_rate": 179,
    "cost_high_rate": 173,
    "aurora_low": 73,
    "aurora_mid": 68,
    "aurora_high": 173,
    "tag_label": 243,
    "head_agent": 76,
    "head_thinking": 179
  }
}
