{
  "$schema": "../../docs/theme-schema.json",
  "theme": "copper-noir",
  "author": "cc-pulseline (design-lab: true-black ground, warm copper signal)",
  "description": "True-black copper instrument \u2014 warm copper signal, sage stable. The lone warm theme.",
  "colors": {
    "emphasis": {
      "primary": 254,
      "secondary": 144,
      "structural": 242,
      "separator": 235
    },
    "alerts": {
      "critical": 167,
      "warning": 179,
      "git_dirty": 173,
      "high_burn": 174
    },
    "active": {
      "accent": 173,
      "success": 248,
      "git_clean": 108
    }
  },
  "palette_mapping": {
    "emphasis_primary": 254,
    "emphasis_secondary": 144,
    "emphasis_structural": 242,
    "emphasis_separator": 235,
    "alert_red": 167,
    "alert_orange": 173,
    "alert_magenta": 174,
    "active_cyan": 173,
    "active_purple": 173,
    "active_teal": 173,
    "active_amber": 179,
    "active_coral": 173,
    "stable_blue": 248,
    "stable_green": 108,
    "indicator_claude_md": 248,
    "indicator_rules": 108,
    "indicator_memory": 144,
    "indicator_hooks": 179,
    "indicator_mcp": 173,
    "indicator_skills": 173,
    "indicator_duration": 144,
    "completed_check": 248,
    "cost_base": 180,
    "cost_low_rate": 248,
    "cost_med_rate": 179,
    "cost_high_rate": 167,
    "strata_state": 235,
    "strata_activity": 242,
    "aurora_low": 108,
    "aurora_mid": 179,
    "aurora_high": 167,
    "tag_label": 242,
    "head_agent": 173,
    "head_thinking": 179
  },
  "light_emphasis": {
    "primary": 234,
    "secondary": 240,
    "structural": 245,
    "separator": 251,
    "strata_state": 252,
    "strata_activity": 246,
    "alert_red": 167,
    "alert_orange": 173,
    "alert_magenta": 174,
    "active_cyan": 173,
    "active_purple": 173,
    "active_teal": 173,
    "active_amber": 179,
    "active_coral": 173,
    "stable_blue": 108,
    "stable_green": 108,
    "indicator_claude_md": 108,
    "indicator_rules": 108,
    "indicator_memory": 144,
    "indicator_hooks": 179,
    "indicator_mcp": 173,
    "indicator_skills": 173,
    "indicator_duration": 144,
    "completed_check": 108,
    "cost_base": 143,
    "cost_low_rate": 108,
    "cost_med_rate": 179,
    "cost_high_rate": 167,
    "aurora_low": 108,
    "aurora_mid": 179,
    "aurora_high": 167,
    "tag_label": 242,
    "head_agent": 173,
    "head_thinking": 179
  }
}
