{
  "$schema": "../../docs/theme-schema.json",
  "theme": "mako-reactor",
  "author": "Gemini",
  "description": "Final Fantasy VII: Shinra industrial steel, Mako energy cyan-green, colorful Materia accents.",

  "colors": {
    "emphasis": {
      "primary": 255,
      "secondary": 252,
      "structural": 73,
      "separator": 239
    },
    "alerts": {
      "critical": 196,
      "warning": 220,
      "git_dirty": 208,
      "high_burn": 199
    },
    "active": {
      "accent": 43,
      "success": 46,
      "git_clean": 39
    }
  },

  "palette_mapping": {
    "emphasis_primary": 255,
    "emphasis_secondary": 252,
    "emphasis_structural": 244,
    "emphasis_separator": 239,

    "alert_red": 196,
    "alert_orange": 208,
    "alert_magenta": 199,

    "active_cyan": 43,
    "active_purple": 135,
    "active_teal": 50,
    "active_amber": 220,
    "active_coral": 203,

    "stable_blue": 39,
    "stable_green": 34,

    "indicator_claude_md": 46,
    "indicator_rules": 220,
    "indicator_memory": 135,
    "indicator_hooks": 39,
    "indicator_mcp": 203,
    "indicator_skills": 50,
    "indicator_duration": 73,

    "completed_check": 108,

    "cost_base": 250,
    "cost_low_rate": 73,
    "cost_med_rate": 220,
    "cost_high_rate": 196,

    "strata_state": 239,
    "strata_activity": 60
  },

  "light_emphasis": {
    "primary": 232,
    "secondary": 238,
    "structural": 245,
    "separator": 252,
    "strata_state": 252,
    "strata_activity": 245
  },

  "design_notes": {
    "philosophy": "FFVII Shinra Terminal & Mako Energy. Multi-accent with Materia-inspired activity colors. Industrial cyan-teal structural framework with glowing Mako green accents.",
    "color_vocabulary": {
      "244_industrial_gray": "Structural infrastructure / Labels",
      "73_shinra_steel":    "Time duration / Muted metallic data",
      "43_mako_energy":     "Tool activity / Completed state / Core glow",
      "135_materia_purple":  "Agent activity / Independent Materia / Memories",
      "50_materia_teal":    "Todo activity / Support Materia / Skills",
      "39_materia_blue":    "Support Materia / Model identity / Hooks",
      "46_materia_green":   "Magic Materia / Clean branch / CLAUDE.md",
      "220_materia_yellow": "Command Materia / Warning / Rules",
      "203_materia_red":    "Summon Materia / Git ahead-behind / MCPs",
      "196_weapon":         "Critical threshold / Danger",
      "199_meteor":         "Extreme cost burn / Impending doom"
    }
  }
}
