{
  "$schema": "../../docs/theme-schema.json",
  "theme": "nd-glacier",
  "author": "cc-pulseline (design-lab: cold premium slate, glacial-blue + frost-mint)",
  "description": "Cold premium slate, glacial-blue + frost-mint, rose alert \u2014 deck register.",
  "colors": {
    "emphasis": {
      "primary": 255,
      "secondary": 145,
      "structural": 243,
      "separator": 236
    },
    "alerts": {
      "critical": 174,
      "warning": 180,
      "git_dirty": 180,
      "high_burn": 182
    },
    "active": {
      "accent": 110,
      "success": 109,
      "git_clean": 109
    }
  },
  "palette_mapping": {
    "emphasis_primary": 255,
    "emphasis_secondary": 145,
    "emphasis_structural": 243,
    "emphasis_separator": 236,
    "alert_red": 174,
    "alert_orange": 180,
    "alert_magenta": 182,
    "active_cyan": 110,
    "active_purple": 110,
    "active_teal": 110,
    "active_amber": 180,
    "active_coral": 180,
    "stable_blue": 109,
    "stable_green": 109,
    "indicator_claude_md": 109,
    "indicator_rules": 109,
    "indicator_memory": 145,
    "indicator_hooks": 180,
    "indicator_mcp": 110,
    "indicator_skills": 110,
    "indicator_duration": 152,
    "completed_check": 109,
    "cost_base": 186,
    "cost_low_rate": 109,
    "cost_med_rate": 180,
    "cost_high_rate": 180,
    "strata_state": 235,
    "strata_activity": 240,
    "aurora_low": 109,
    "aurora_mid": 114,
    "aurora_high": 182,
    "tag_label": 243,
    "head_agent": 182,
    "head_thinking": 180
  },
  "light_emphasis": {
    "primary": 234,
    "secondary": 240,
    "structural": 245,
    "separator": 251,
    "strata_state": 252,
    "strata_activity": 246,
    "alert_red": 174,
    "alert_orange": 143,
    "alert_magenta": 175,
    "active_cyan": 110,
    "active_purple": 110,
    "active_teal": 110,
    "active_amber": 143,
    "active_coral": 174,
    "stable_blue": 109,
    "stable_green": 109,
    "indicator_claude_md": 109,
    "indicator_rules": 109,
    "indicator_memory": 145,
    "indicator_hooks": 143,
    "indicator_mcp": 110,
    "indicator_skills": 110,
    "indicator_duration": 146,
    "completed_check": 109,
    "cost_base": 144,
    "cost_low_rate": 109,
    "cost_med_rate": 143,
    "cost_high_rate": 174,
    "aurora_low": 109,
    "aurora_mid": 114,
    "aurora_high": 175,
    "tag_label": 243,
    "head_agent": 175,
    "head_thinking": 143
  }
}
