{
  "$schema": "../../docs/theme-schema.json",
  "theme": "nd-flux",
  "author": "cc-pulseline (design-lab: near-black, electric-lime active, hot velocity)",
  "description": "Near-black, electric-lime active, blue -> lime -> magenta velocity \u2014 monobar register.",
  "colors": {
    "emphasis": {
      "primary": 255,
      "secondary": 249,
      "structural": 243,
      "separator": 236
    },
    "alerts": {
      "critical": 203,
      "warning": 215,
      "git_dirty": 215,
      "high_burn": 205
    },
    "active": {
      "accent": 155,
      "success": 79,
      "git_clean": 79
    }
  },
  "palette_mapping": {
    "emphasis_primary": 255,
    "emphasis_secondary": 249,
    "emphasis_structural": 243,
    "emphasis_separator": 236,
    "alert_red": 203,
    "alert_orange": 215,
    "alert_magenta": 205,
    "active_cyan": 155,
    "active_purple": 155,
    "active_teal": 155,
    "active_amber": 215,
    "active_coral": 209,
    "stable_blue": 75,
    "stable_green": 79,
    "indicator_claude_md": 75,
    "indicator_rules": 79,
    "indicator_memory": 249,
    "indicator_hooks": 215,
    "indicator_mcp": 75,
    "indicator_skills": 155,
    "indicator_duration": 117,
    "completed_check": 79,
    "cost_base": 221,
    "cost_low_rate": 79,
    "cost_med_rate": 215,
    "cost_high_rate": 209,
    "strata_state": 235,
    "strata_activity": 240,
    "aurora_low": 75,
    "aurora_mid": 155,
    "aurora_high": 205,
    "tag_label": 243,
    "head_agent": 155,
    "head_thinking": 215
  },
  "light_emphasis": {
    "primary": 234,
    "secondary": 240,
    "structural": 245,
    "separator": 251,
    "strata_state": 252,
    "strata_activity": 246,
    "alert_red": 203,
    "alert_orange": 179,
    "alert_magenta": 205,
    "active_cyan": 107,
    "active_purple": 107,
    "active_teal": 107,
    "active_amber": 179,
    "active_coral": 209,
    "stable_blue": 75,
    "stable_green": 72,
    "indicator_claude_md": 75,
    "indicator_rules": 72,
    "indicator_memory": 145,
    "indicator_hooks": 179,
    "indicator_mcp": 75,
    "indicator_skills": 107,
    "indicator_duration": 110,
    "completed_check": 72,
    "cost_base": 179,
    "cost_low_rate": 72,
    "cost_med_rate": 179,
    "cost_high_rate": 209,
    "aurora_low": 75,
    "aurora_mid": 107,
    "aurora_high": 205,
    "tag_label": 243,
    "head_agent": 107,
    "head_thinking": 179
  }
}
