{
  "$schema": "../../docs/theme-schema.json",
  "theme": "nd-ember",
  "author": "cc-pulseline (design-lab: warm umber, amber signal, cool teal counter)",
  "description": "Warm umber ground, amber signal, one cool teal counter \u2014 rail register.",
  "colors": {
    "emphasis": {
      "primary": 254,
      "secondary": 248,
      "structural": 242,
      "separator": 236
    },
    "alerts": {
      "critical": 167,
      "warning": 173,
      "git_dirty": 173,
      "high_burn": 173
    },
    "active": {
      "accent": 179,
      "success": 66,
      "git_clean": 108
    }
  },
  "palette_mapping": {
    "emphasis_primary": 254,
    "emphasis_secondary": 248,
    "emphasis_structural": 242,
    "emphasis_separator": 236,
    "alert_red": 167,
    "alert_orange": 173,
    "alert_magenta": 173,
    "active_cyan": 179,
    "active_purple": 179,
    "active_teal": 179,
    "active_amber": 173,
    "active_coral": 173,
    "stable_blue": 66,
    "stable_green": 108,
    "indicator_claude_md": 66,
    "indicator_rules": 108,
    "indicator_memory": 248,
    "indicator_hooks": 173,
    "indicator_mcp": 66,
    "indicator_skills": 179,
    "indicator_duration": 180,
    "completed_check": 66,
    "cost_base": 186,
    "cost_low_rate": 66,
    "cost_med_rate": 173,
    "cost_high_rate": 173,
    "strata_state": 235,
    "strata_activity": 239,
    "aurora_low": 137,
    "aurora_mid": 179,
    "aurora_high": 173,
    "tag_label": 242,
    "head_agent": 179,
    "head_thinking": 173
  },
  "light_emphasis": {
    "primary": 234,
    "secondary": 240,
    "structural": 245,
    "separator": 251,
    "strata_state": 252,
    "strata_activity": 246,
    "alert_red": 167,
    "alert_orange": 173,
    "alert_magenta": 173,
    "active_cyan": 179,
    "active_purple": 179,
    "active_teal": 179,
    "active_amber": 173,
    "active_coral": 173,
    "stable_blue": 66,
    "stable_green": 108,
    "indicator_claude_md": 66,
    "indicator_rules": 108,
    "indicator_memory": 246,
    "indicator_hooks": 173,
    "indicator_mcp": 66,
    "indicator_skills": 179,
    "indicator_duration": 144,
    "completed_check": 66,
    "cost_base": 179,
    "cost_low_rate": 66,
    "cost_med_rate": 173,
    "cost_high_rate": 173,
    "aurora_low": 137,
    "aurora_mid": 179,
    "aurora_high": 173,
    "tag_label": 242,
    "head_agent": 179,
    "head_thinking": 173
  }
}
