{
  "$schema": "../../docs/theme-schema.json",
  "theme": "signal-phosphor",
  "author": "cc-pulseline (design-lab: oscilloscope green on near-black)",
  "description": "Phosphor-green CRT \u2014 one green family, amber warn, red crit. Velocity reads green -> lime -> amber.",
  "colors": {
    "emphasis": {
      "primary": 194,
      "secondary": 114,
      "structural": 65,
      "separator": 235
    },
    "alerts": {
      "critical": 203,
      "warning": 185,
      "git_dirty": 215,
      "high_burn": 216
    },
    "active": {
      "accent": 79,
      "success": 78,
      "git_clean": 78
    }
  },
  "palette_mapping": {
    "emphasis_primary": 194,
    "emphasis_secondary": 114,
    "emphasis_structural": 65,
    "emphasis_separator": 235,
    "alert_red": 203,
    "alert_orange": 215,
    "alert_magenta": 216,
    "active_cyan": 79,
    "active_purple": 79,
    "active_teal": 79,
    "active_amber": 185,
    "active_coral": 215,
    "stable_blue": 78,
    "stable_green": 78,
    "indicator_claude_md": 78,
    "indicator_rules": 78,
    "indicator_memory": 114,
    "indicator_hooks": 215,
    "indicator_mcp": 79,
    "indicator_skills": 185,
    "indicator_duration": 114,
    "completed_check": 78,
    "cost_base": 186,
    "cost_low_rate": 78,
    "cost_med_rate": 185,
    "cost_high_rate": 215,
    "strata_state": 235,
    "strata_activity": 65,
    "aurora_low": 35,
    "aurora_mid": 77,
    "aurora_high": 215,
    "tag_label": 65,
    "head_agent": 185,
    "head_thinking": 215
  },
  "light_emphasis": {
    "primary": 234,
    "secondary": 240,
    "structural": 245,
    "separator": 251,
    "strata_state": 252,
    "strata_activity": 246,
    "alert_red": 203,
    "alert_orange": 179,
    "alert_magenta": 210,
    "active_cyan": 72,
    "active_purple": 72,
    "active_teal": 72,
    "active_amber": 143,
    "active_coral": 179,
    "stable_blue": 72,
    "stable_green": 72,
    "indicator_claude_md": 72,
    "indicator_rules": 72,
    "indicator_memory": 108,
    "indicator_hooks": 179,
    "indicator_mcp": 72,
    "indicator_skills": 143,
    "indicator_duration": 108,
    "completed_check": 72,
    "cost_base": 144,
    "cost_low_rate": 72,
    "cost_med_rate": 143,
    "cost_high_rate": 179,
    "aurora_low": 35,
    "aurora_mid": 71,
    "aurora_high": 179,
    "tag_label": 65,
    "head_agent": 143,
    "head_thinking": 179
  }
}
